id,context,question,reponse_attendue,reponse_obtenue,context_idx
22,"la inclut, par exemple : - Des projets d’aide d'urgence - comme pour soutenir les enfants impactés par les conflits avec Unicef - Des initiatives d’insertion professionnelle pour des personnes éloignées du marché du travail – comme notre partenariat avec Collectif Sports - Le soutien à la recherche liées à des maladies – comme avec le Téléthon ou les Invincibles - La participation à des projets d’associations locales – comme avec le financement d’un triporteur de 1 lettre 1 sourire, qui sera garé dans notre parking de Boulogne- Billancourt et permettra à des ainé(e)s de pouvoir être transporté(e)s hors de leur EHPAD L’implication de nos collaborateurs dans les décisions étant essentielle, nous leur offrons la possibilité de participer à l'attribution d'une partie de ces fonds. Les associations bénéficiaires sont choisies à travers un appel à projets ouvert aux structures externes, suivi ",Quels types de projets sont soutenus par l'initiative mentionnée dans le texte ?,"Les projets incluent des aides d'urgence avec Unicef, des initiatives d'insertion professionnelle avec Collectif Sports, le soutien à la recherche pour des maladies comme avec le Téléthon, et des projets d'associations locales comme le financement d'un triporteur pour 1 lettre 1 sourire.",,21
23,"ttribution d'une partie de ces fonds. Les associations bénéficiaires sont choisies à travers un appel à projets ouvert aux structures externes, suivi d’un processus de vote interne. Pour qu’une association puisse soumettre un projet, il faut qu’elle respecte les critères d’éligibilité suivants : - Etre reconnue d’intérêt général (loi 1901 ou d’utilité publique) - Contribuer à l’un des 17 objectifs de développement durable des Nations Unies - Avoir un impact local, c’est-à-dire situé à moins de 80km d’un de nos sites - Pouvoir présenter des résultats mesurables sous un an - Ne pas être une organisation politique, syndicale, ou religieuse, une association de parents d’élèves ni une structure exclusivement sportive. Document Restreint - Interne & Partenaire Mécénat de compétences et bénévolat Davidson s'engage à soutenir l'implication personnelle de ses collaborateurs et collaboratrices dan",Quels sont les critères d'éligibilité qu'une association doit respecter pour soumettre un projet?,"L'association doit être reconnue d'intérêt général, contribuer à l'un des 17 objectifs de développement durable des Nations Unies, avoir un impact local, présenter des résultats mesurables sous un an, et ne pas être une organisation politique, syndicale, religieuse, une association de parents d’élèves ou exclusivement sportive.",,22
24,"e & Partenaire Mécénat de compétences et bénévolat Davidson s'engage à soutenir l'implication personnelle de ses collaborateurs et collaboratrices dans des projets à impact social et sociétal. Pour cela, nous avons mis en place plusieurs dispositifs, tels que des missions de compétences de moyenne durée pour des associations d’intérêt général. Par exemple, en 2024, nous avons apporté notre expertise en cybersécurité aux associations Planète Urgence et Téléthon. De plus, notre programme d'engagement solidaire, SoliDav, permet à nos collaborateurs de s'impliquer concrètement : De quoi parle-t-on exactement ? SoliDav est notre programme d’engagement solidaire destiné aux collaborateurs et collaboratrices de Davidson. Il vise à créer des liens entre des associations ayant des besoins spécifiques et nos salarié·es, leur permettant de consacrer jusqu’à 3 jours par an de leur temps de travail à",Quel est l'objectif du programme SoliDav de Davidson?,"Le programme SoliDav vise à créer des liens entre des associations ayant des besoins spécifiques et les employés de Davidson, leur permettant de consacrer jusqu'à 3 jours par an de leur temps de travail à ces associations.",,23
25,"entre des associations ayant des besoins spécifiques et nos salarié·es, leur permettant de consacrer jusqu’à 3 jours par an de leur temps de travail à des missions d’intérêt général, et de manière illimitée pendant leurs périodes d’intercontrat, à proximité de leur lieu de travail. N’hésitez pas à en profiter lors de vos périodes d'IC ! Trois types d’actions… ▪ Les missions « coup de pouce » : elles n’ont pas de lien direct avec les compétences professionnelles. Par exemple, donner son sang ou ramasser des déchets ; ▪ Les missions « compétence » : elles font appels aux acquis pro/perso et nécessitent un degré d’expertise dans le domaine. Par exemple, faire passer une simulation d’entretien de recrutement à un jeune ou jouer de la musique lors d’un évènement. ▪ Les missions « parrainage/marrainage » : sont des actions récurrentes permettant d’accompagner une personne en situation de fragi",Combien de types d'actions les salariés peuvent-ils réaliser en consacrant du temps à des missions d'intérêt général ?,"Les salariés peuvent réaliser trois types d'actions : les missions « coup de pouce », les missions « compétence » et les missions « parrainage/marrainage ».",,24
26,"rs d’un évènement. ▪ Les missions « parrainage/marrainage » : sont des actions récurrentes permettant d’accompagner une personne en situation de fragilité sociale. Par exemple, accompagner une personne réfugiée pendant 6 mois dans son projet professionnelle ou aider un enfant à faire ses devoir s régulièrement. …et encore bien d’autres formats ! SoliDav propose diverses actions de sensibilisation aux enjeux environnementaux, sociaux et sociétaux. Certaines mènent à des formations internes (ex. : « Atelier sur les enjeux planétaires »), d’autres sont animées par nos associations partenaires (ex. : « Réagir face au harcèlement de rue », « Fruits et légumes de saison », « Trier ses déchets », etc.). Nous organisons également régulièrement des collectes d’objets pour des associations partenaires. Sur notre site de Boulogne-Billancourt nous avons même dédié un espace à Document Restreint - In",Quelles actions récurrentes propose SoliDav pour accompagner des personnes en situation de fragilité sociale ?,"SoliDav propose des missions de parrainage/marrainage, comme accompagner une personne réfugiée dans son projet professionnel pendant 6 mois ou aider un enfant à faire ses devoirs régulièrement.",,25
27,"collectes d’objets pour des associations partenaires. Sur notre site de Boulogne-Billancourt nous avons même dédié un espace à Document Restreint - Interne & Partenaire cet usage, nommé « Ressourcerie », dans lequel nous organisons des collectes d’objets tous les mois. Par exemple, en 2024 nous avons collecté des vêtements pour Emmaüs défi, des jouets pour Rejoué, des livres pour Bibliothèque s sans frontière, d u matériel informatique pour Paratonnerre, des vêtements de sport pour Kabubu, des fournitures scolaires pour les Apprentis d’ Auteuil et aussi des boites à chaussure rempli de petits présents pour que l’association des Restos du Cœur puisse les distribuer à des personnes dans la rue le soir de Noël ! Associations, vous avez des besoins pour lesquels nos salarié.e.s pourraient vous aider ? 1. Inscrivez votre asso sur ce formulaire. Sélectionnez “Partenaire avec une entreprise “ e",Quelle association a bénéficié de la collecte de vêtements organisée par la Ressourcerie en 2024?,Emmaüs défi a bénéficié de la collecte de vêtements organisée par la Ressourcerie en 2024.,,26
28,"oins pour lesquels nos salarié.e.s pourraient vous aider ? 1. Inscrivez votre asso sur ce formulaire. Sélectionnez “Partenaire avec une entreprise “ et précisez « Davidson » comme entreprise ; 2. Une fois votre demande validée, vous recevrez un mail d'activation de la part de hello@wenabi.com ; 3. Connectez-vous sur wenabi.com, complétez le profil de votre association et crée votre première mission. Pour toute tes questions sur l’outil ou pour créer des accès supplémentaires à tes collègues, vous pouvez envoyer une demande à contact@wenabi.com.",Quelle est l'adresse email à contacter pour poser des questions sur l'outil ou créer des accès supplémentaires pour des collègues ?,Vous pouvez envoyer une demande à contact@wenabi.com.,,27
