id,context,question,reponse_attendue,reponse_obtenue,context_idx
1,"(1) (2) (3) (4) (5) vu le traité sur le fonctionnement de l'Union européenne, et notamment son article 16, vu la proposition de la Commission européenne, après transmission du projet d'acte législatif aux parlements nationaux, vu l'avis du Comité économique et social européen, vu l'avis du Comité des régions, statuant conformément à la procédure législative ordinaire, considérant ce qui suit: La protection des personnes physiques à l'égard du traitement des données à caractère personnel est un droit fondamental. L'article 8, paragraphe 1, de la Charte des droits fondamentaux de l'Union européenne (ci-après dénommée «Charte») et l'article 16, paragraphe 1, du traité sur le fonctionnement de l'Union européenne disposent que toute personne a droit à la protection des données à caractère personnel la concernant. Les principes et les règles régissant la protection des personnes physiques à l'",Quelle disposition du traité sur le fonctionnement de l'Union européenne garantit le droit à la protection des données à caractère personnel?,"L'article 16, paragraphe 1, du traité sur le fonctionnement de l'Union européenne garantit le droit à la protection des données à caractère personnel.",,0
2,"roit à la protection des données à caractère personnel la concernant. Les principes et les règles régissant la protection des personnes physiques à l'égard du traitement des données à caractère personnel les concernant devraient, quelle que soit la nationalité ou la résidence de ces personnes physiques, respecter leurs libertés et droits fondamentaux, en particulier leur droit à la protection des données à caractère personnel. Le présent règlement vise à contribuer à la réalisation d'un espace de liberté, de sécurité et de justice et d'une union économique, au progrès économique et social, à la consolidation et à la convergence des économies au sein du marché intérieur, ainsi qu'au bien-être des personnes physiques. La directive 95/46/CE du Parlement européen et du Conseil vise à harmoniser la protection des libertés et droits fondamentaux des personnes physiques en ce qui concerne les a",Quel est l'objectif principal du règlement concernant le traitement des données à caractère personnel?,"Le règlement vise à respecter les libertés et droits fondamentaux des personnes, en particulier leur droit à la protection des données à caractère personnel, quelle que soit leur nationalité ou leur résidence.",,1
3," Parlement européen et du Conseil vise à harmoniser la protection des libertés et droits fondamentaux des personnes physiques en ce qui concerne les activités de traitement et à assurer le libre flux des données à caractère personnel entre les États membres. Le traitement des données à caractère personnel devrait être conçu pour servir l'humanité. Le droit à la protection des données à caractère personnel n'est pas un droit absolu; il doit être considéré par rapport à sa fonction dans la société et être mis en balance avec d'autres droits fondamentaux, conformément au principe de proportionnalité. Le présent règlement respecte tous les droits fondamentaux et observe les libertés et les principes reconnus par la Charte, consacrés par les traités, en particulier le respect de la vie privée et familiale, du domicile et des communications, la protection des données à caractère personnel, la ",Quel est l'objectif principal du règlement du Parlement européen et du Conseil concernant la protection des données à caractère personnel?,L'objectif principal est d'harmoniser la protection des libertés et droits fondamentaux des personnes physiques en matière de traitement de données et d'assurer le libre flux des données personnelles entre les États membres.,,2
4,"ités, en particulier le respect de la vie privée et familiale, du domicile et des communications, la protection des données à caractère personnel, la liberté de pensée, de conscience et de religion, la liberté d'expression et d'information, la liberté d'entreprise, le droit à un recours effectif et à accéder à un tribunal impartial, et la diversité culturelle, religieuse et linguistique. L'intégration économique et sociale résultant du fonctionnement du marché intérieur a conduit à une augmentation substantielle des flux transfrontaliers de données à caractère personnel. Les échanges de données à caractère personnel entre acteurs publics et privés, y compris les personnes physiques, les associations et les entreprises, se sont intensifiés dans l'ensemble de l'Union. Le droit de l'Union appelle les autorités nationales des États membres à coopérer et à échanger des données à caractère per",Qu'a causé l'intégration économique et sociale due au marché intérieur selon le texte?,Elle a conduit à une augmentation substantielle des flux transfrontaliers de données à caractère personnel.,,3
5,"ans l'ensemble de l'Union. Le droit de l'Union appelle les autorités nationales des États membres à coopérer et à échanger des données à caractère personnel, afin d'être en mesure de remplir leurs missions ou d'accomplir des tâches pour le compte d'une autorité d'un autre État membre. 15/07/2025 10:16 Le règlement général sur la protection des données - RGPD | CNIL https://www.cnil.fr/fr/reglement-europeen-protection-donnees 5/47 (6) (7) (8) (9) (10) L'évolution rapide des technologies et la mondialisation ont créé de nouveaux enjeux pour la protection des données à caractère personnel. L'ampleur de la collecte et du partage de données à caractère personnel a augmenté de manière importante. Les technologies permettent tant aux entreprises privées qu'aux autorités publiques d'utiliser les données à caractère personnel comme jamais auparavant dans le cadre de leurs activités. De plus en pl",Quel nouveau défi est mentionné pour la protection des données dans le texte ?,L'évolution rapide des technologies et la mondialisation ont créé de nouveaux enjeux pour la protection des données à caractère personnel.,"L'information demandée n'est pas présente dans les extraits fournis (RGPD, articles 1-19). Veuillez fournir plus de détails ou vérifier d'autres sources.",4
6,"rivées qu'aux autorités publiques d'utiliser les données à caractère personnel comme jamais auparavant dans le cadre de leurs activités. De plus en plus, les personnes physiques rendent des informations les concernant accessibles publiquement et à un niveau mondial. Les technologies ont transformé à la fois l'économie et les rapports sociaux, et elles devraient encore faciliter le libre flux des données à caractère personnel au sein de l'Union et leur transfert vers des pays tiers et à des organisations internationales, tout en assurant un niveau élevé de protection des données à caractère personnel. Ces évolutions requièrent un cadre de protection des données solide et plus cohérent dans l'Union, assorti d'une application rigoureuse des règles, car il importe de susciter la confiance qui permettra à l'économie numérique de se développer dans l'ensemble du marché intérieur. Les personnes",Qu'est-ce que l'évolution technologique devrait faciliter selon le texte extrait du RGPD?,"Selon le texte, l'évolution technologique devrait faciliter le libre flux des données à caractère personnel au sein de l'Union, leur transfert vers des pays tiers et des organisations internationales, tout en assurant un niveau élevé de protection des données.",,5
7,"gles, car il importe de susciter la confiance qui permettra à l'économie numérique de se développer dans l'ensemble du marché intérieur. Les personnes physiques devraient avoir le contrôle des données à caractère personnel les concernant. La sécurité tant juridique que pratique devrait être renforcée pour les personnes physiques, les opérateurs économiques et les autorités publiques. Lorsque le présent règlement dispose que le droit d'un État membre peut apporter des précisions ou des limitations aux règles qu'il prévoit, les États membres peuvent intégrer des éléments du présent règlement dans leur droit dans la mesure nécessaire pour garantir la cohérence et pour rendre les dispositions nationales compréhensibles pour les personnes auxquelles elles s'appliquent. Si elle demeure satisfaisante en ce qui concerne ses objectifs et ses principes, la directive 95/46/CE n'a pas permis d'évite",Quel contrôle devraient avoir les personnes physiques selon le texte extrait du RGPD?,Les personnes physiques devraient avoir le contrôle des données à caractère personnel les concernant.,,6
8,"lles elles s'appliquent. Si elle demeure satisfaisante en ce qui concerne ses objectifs et ses principes, la directive 95/46/CE n'a pas permis d'éviter une fragmentation de la mise en œuvre de la protection des données dans l'Union, une insécurité juridique ou le sentiment, largement répandu dans le public, que des risques importants pour la protection des personnes physiques subsistent, en particulier en ce qui concerne l'environnement en ligne. Les différences dans le niveau de protection des droits et libertés des personnes physiques, en particulier le droit à la protection des données à caractère personnel, à l'égard du traitement des données à caractère personnel dans les États membres peuvent empêcher le libre flux de ces données dans l'ensemble de l'Union. Ces différences peuvent dès lors constituer un obstacle à l'exercice des activités économiques au niveau de l'Union, fausser l",Quel était un des problèmes de la directive 95/46/CE en ce qui concerne la protection des données dans l'Union Européenne ?,"La directive 95/46/CE n'a pas permis d'éviter une fragmentation de la mise en œuvre de la protection des données dans l'Union, créant ainsi une insécurité juridique.",,7
9," l'ensemble de l'Union. Ces différences peuvent dès lors constituer un obstacle à l'exercice des activités économiques au niveau de l'Union, fausser la concurrence et empêcher les autorités de s'acquitter des obligations qui leur incombent en vertu du droit de l'Union. Ces différences dans le niveau de protection résultent de l'existence de divergences dans la mise en œuvre et l'application de la directive 95/46/CE. Afin d'assurer un niveau cohérent et élevé de protection des personnes physiques et de lever les obstacles aux flux de données à caractère personnel au sein de l'Union, le niveau de protection des droits et des libertés des personnes physiques à l'égard du traitement de ces données devrait être équivalent dans tous les États membres. Il convient dès lors d'assurer une application cohérente et homogène des règles de protection des libertés et droits fondamentaux des personnes ",Quel problème les différences dans la mise en œuvre de la directive 95/46/CE peuvent-elles causer au sein de l'Union?,"Elles peuvent constituer un obstacle à l'exercice des activités économiques, fausser la concurrence et empêcher les autorités de s'acquitter de leurs obligations en vertu du droit de l'Union.",,8
10,"bres. Il convient dès lors d'assurer une application cohérente et homogène des règles de protection des libertés et droits fondamentaux des personnes physiques à l'égard du traitement des données à caractère personnel dans l'ensemble de l'Union. En ce qui concerne le traitement de données à caractère personnel nécessaire au respect d'une obligation légale, à l'exécution d'une mission d'intérêt public ou relevant de l'exercice de l'autorité publique dont est investi le responsable du traitement, il y a lieu d'autoriser les États membres à maintenir ou à introduire des dispositions nationales destinées à préciser davantage l'application des règles du présent règlement. Parallèlement à la législation générale et horizontale relative à la protection des données mettant en œuvre la directive 95/46/CE, il existe, dans les États membres, 15/07/2025 10:16 Le règlement général sur la protection d",Que peuvent faire les États membres en matière de protection des données personnelles selon le RGPD?,"Les États membres peuvent maintenir ou introduire des dispositions nationales pour préciser davantage l'application des règles du RGPD lorsqu'il s'agit du traitement de données personnelles nécessaire au respect d'une obligation légale, à l'exécution d'une mission d'intérêt public, ou relevant de l'autorité publique.",,9
11,"ction des données mettant en œuvre la directive 95/46/CE, il existe, dans les États membres, 15/07/2025 10:16 Le règlement général sur la protection des données - RGPD | CNIL https://www.cnil.fr/fr/reglement-europeen-protection-donnees 6/47 (11) (12) (13) (14) (15) plusieurs législations sectorielles spécifiques dans des domaines qui requièrent des dispositions plus précises. Le présent règlement laisse aussi aux États membres une marge de manœuvre pour préciser ses règles, y compris en ce qui concerne le traitement de catégories particulières de données à caractère personnel (ci-après dénommées «données sensibles»). À cet égard, le présent règlement n'exclut pas que le droit des États membres précise les circonstances des situations particulières de traitement y compris en fixant de manière plus précise les conditions dans lesquelles le traitement de données à caractère personnel est li",Le règlement général sur la protection des données permet-il aux États membres de préciser ses règles concernant les données sensibles ?,"Oui, le règlement laisse aux États membres une marge de manœuvre pour préciser les règles concernant le traitement de données sensibles.",,10
12,"ulières de traitement y compris en fixant de manière plus précise les conditions dans lesquelles le traitement de données à caractère personnel est licite. Une protection effective des données à caractère personnel dans l'ensemble de l'Union exige de renforcer et de préciser les droits des personnes concernées et les obligations de ceux qui effectuent et déterminent le traitement des données à caractère personnel, ainsi que de prévoir, dans les États membres, des pouvoirs équivalents de surveillance et de contrôle du respect des règles relatives à la protection des données à caractère personnel et des sanctions équivalentes pour les violations. L'article 16, paragraphe 2, du traité sur le fonctionnement de l'Union européenne donne mandat au Parlement européen et au Conseil pour fixer les règles relatives à la protection des personnes physiques à l'égard du traitement des données à caract","Quel mandat l'article 16, paragraphe 2, du traité sur le fonctionnement de l'Union européenne donne-t-il au Parlement européen et au Conseil?","L'article 16, paragraphe 2, du traité sur le fonctionnement de l'Union européenne mandate le Parlement européen et le Conseil pour fixer les règles relatives à la protection des personnes physiques à l'égard du traitement des données à caractère personnel.",,11
13," Parlement européen et au Conseil pour fixer les règles relatives à la protection des personnes physiques à l'égard du traitement des données à caractère personnel ainsi que les règles relatives à la libre circulation des données à caractère personnel. Afin d'assurer un niveau cohérent de protection des personnes physiques dans l'ensemble de l'Union, et d'éviter que des divergences n'entravent la libre circulation des données à caractère personnel au sein du marché intérieur, un règlement est nécessaire pour garantir la sécurité juridique et la transparence aux opérateurs économiques, y compris les micro, petites et moyennes entreprises, pour offrir aux personnes physiques de tous les États membres un même niveau de droits opposables et d'obligations et de responsabilités pour les responsables du traitement et les sous- traitants, et pour assurer une surveillance cohérente du traitement ",Quel est l'objectif principal du règlement mentionné dans le texte concernant la protection des données à caractère personnel?,L'objectif principal est d'assurer un niveau cohérent de protection des personnes physiques dans l'ensemble de l'Union et d'éviter que des divergences n'entravent la libre circulation des données à caractère personnel au sein du marché intérieur.,,12
14,"bligations et de responsabilités pour les responsables du traitement et les sous- traitants, et pour assurer une surveillance cohérente du traitement des données à caractère personnel, et des sanctions équivalentes dans tous les États membres, ainsi qu'une coopération efficace entre les autorités de contrôle des différents États membres. Pour que le marché intérieur fonctionne correctement, il est nécessaire que la libre circulation des données à caractère personnel au sein de l'Union ne soit ni limitée ni interdite pour des motifs liés à la protection des personnes physiques à l'égard du traitement des données à caractère personnel. Pour tenir compte de la situation particulière des micro, petites et moyennes entreprises, le présent règlement comporte une dérogation pour les organisations occupant moins de 250 employés en ce qui concerne la tenue de registres. Les institutions et organe","Quelle dérogation le règlement RGPD prévoit-il pour les micro, petites et moyennes entreprises?",Le règlement comporte une dérogation pour les organisations occupant moins de 250 employés en ce qui concerne la tenue de registres.,"L'extrait ne mentionne aucune dérogation spécifique accordée par le RGPD aux micro, petites et moyennes entreprises en relation avec la directive (UE) 2016/680. Toutefois, il indique qu'une dérogation existe pour les organisations occupant moins de 250 employés concernant la tenue de registres. Pour des informations détaillées sur la directive (UE) 2016/680, il faudrait consulter directement le texte de la directive ou d'autres sources pertinentes.",13
15,"ent comporte une dérogation pour les organisations occupant moins de 250 employés en ce qui concerne la tenue de registres. Les institutions et organes de l'Union, et les États membres et leurs autorités de contrôle sont en outre encouragés à prendre en considération les besoins spécifiques des micro, petites et moyennes entreprises dans le cadre de l'application du présent règlement. Pour définir la notion de micro, petites et moyennes entreprises, il convient de se baser sur l'article 2 de l'annexe de la recommandation 2003/361/CE de la Commission. La protection conférée par le présent règlement devrait s'appliquer aux personnes physiques, indépendamment de leur nationalité ou de leur lieu de résidence, en ce qui concerne le traitement de leurs données à caractère personnel. Le présent règlement ne couvre pas le traitement des données à caractère personnel qui concernent les personnes ",Quelles organisations peuvent bénéficier d'une dérogation concernant la tenue de registres selon le RGPD?,Les organisations occupant moins de 250 employés peuvent bénéficier d'une dérogation concernant la tenue de registres selon le RGPD.,,14
16," leurs données à caractère personnel. Le présent règlement ne couvre pas le traitement des données à caractère personnel qui concernent les personnes morales, et en particulier des entreprises dotées de la personnalité juridique, y compris le nom, la forme juridique et les coordonnées de la personne morale. 15/07/2025 10:16 Le règlement général sur la protection des données - RGPD | CNIL https://www.cnil.fr/fr/reglement-europeen-protection-donnees 7/47 (16) (17) (18) (19) Afin d'éviter de créer un risque grave de contournement, la protection des personnes physiques devrait être neutre sur le plan technologique et ne devrait pas dépendre des techniques utilisées. Elle devrait s'appliquer aux traitements de données à caractère personnel à l'aide de procédés automatisés ainsi qu'aux traitements manuels, si les données à caractère personnel sont contenues ou destinées à être contenues dans u",Le règlement général sur la protection des données (RGPD) couvre-t-il le traitement des données des entreprises dotées de la personnalité juridique?,"Non, le RGPD ne couvre pas le traitement des données à caractère personnel qui concernent les personnes morales, y compris les entreprises dotées de la personnalité juridique.",,15
17,"ide de procédés automatisés ainsi qu'aux traitements manuels, si les données à caractère personnel sont contenues ou destinées à être contenues dans un fichier. Les dossiers ou ensembles de dossiers de même que leurs couvertures, qui ne sont pas structurés selon des critères déterminés ne devraient pas relever du champ d'application du présent règlement. Le présent règlement ne s'applique pas à des questions de protection des libertés et droits fondamentaux ou de libre flux des données à caractère personnel concernant des activités qui ne relèvent pas du champ d'application du droit de l'Union, telles que les activités relatives à la sécurité nationale. Le présent règlement ne s'applique pas au traitement des données à caractère personnel par les États membres dans le contexte de leurs activités ayant trait à la politique étrangère et de sécurité commune de l'Union. Le règlement (CE) no ",Le RGPD s'applique-t-il aux activités relatives à la sécurité nationale?,"Non, le RGPD ne s'applique pas aux activités relatives à la sécurité nationale.",,16
18,"ar les États membres dans le contexte de leurs activités ayant trait à la politique étrangère et de sécurité commune de l'Union. Le règlement (CE) no 45/2001 du Parlement européen et du Conseil s'applique au traitement des données à caractère personnel par les institutions, organes et organismes de l'Union. Le règlement (CE) no 45/2001 et les autres actes juridiques de l'Union applicables audit traitement des données à caractère personnel devraient être adaptés aux principes et aux règles fixés dans le présent règlement et appliqués à la lumière du présent règlement. Pour mettre en place un cadre de protection des données solide et cohérent dans l'Union, il convient, après l'adoption du présent règlement, d'apporter les adaptations nécessaires au règlement (CE) no 45/2001 de manière à ce que celles-ci s'appliquent en même temps que le présent règlement. Le présent règlement ne s'applique","Quel règlement s'applique au traitement des données à caractère personnel par les institutions, organes et organismes de l'Union ?","Le règlement (CE) no 45/2001 du Parlement européen et du Conseil s'applique au traitement des données à caractère personnel par les institutions, organes et organismes de l'Union.",,17
19,"res au règlement (CE) no 45/2001 de manière à ce que celles-ci s'appliquent en même temps que le présent règlement. Le présent règlement ne s'applique pas aux traitements de données à caractère personnel effectués par une personne physique au cours d'activités strictement personnelles ou domestiques, et donc sans lien avec une activité professionnelle ou commerciale. Les activités personnelles ou domestiques pourraient inclure l'échange de correspondance et la tenue d'un carnet d'adresses, ou l'utilisation de réseaux sociaux et les activités en ligne qui ont lieu dans le cadre de ces activités. Toutefois, le présent règlement s'applique aux responsables du traitement ou aux sous-traitants qui fournissent les moyens de traiter des données à caractère personnel pour de telles activités personnelles ou domestiques. La protection des personnes physiques à l'égard du traitement des données à ",Le RGPD s'applique-t-il aux traitements de données effectués par une personne physique pour des activités strictement personnelles ou domestiques?,"Non, le RGPD ne s'applique pas aux traitements de données effectués par une personne physique au cours d'activités strictement personnelles ou domestiques.",,18
20,"caractère personnel pour de telles activités personnelles ou domestiques. La protection des personnes physiques à l'égard du traitement des données à caractère personnel par les autorités compétentes à des fins de prévention et de détection des infractions pénales, d'enquêtes et de poursuites en la matière ou d'exécution de sanctions pénales, y compris la protection contre les menaces pour la sécurité publique et la prévention de telles menaces et la libre circulation de ces données, fait l'objet d'un acte juridique spécifique de l'Union. Le présent règlement ne devrait dès lors pas s'appliquer aux activités de traitement effectuées à ces fins. Toutefois, les données à caractère personnel traitées par des autorités publiques en vertu du présent règlement devraient, lorsqu'elles sont utilisées à ces fins, être régies par un acte juridique de l'Union plus spécifique, à savoir la directive ",À quelles fins le présent règlement ne s'applique-t-il pas?,"Le présent règlement ne s'applique pas aux activités de traitement effectuées à des fins de prévention et de détection des infractions pénales, d'enquêtes, de poursuites, et d'exécution de sanctions pénales, ainsi que pour la protection et la prévention des menaces pour la sécurité publique.",,19
